{
  "$schema": "https://json-schema.org/draft/2020-12/schema",
  "title": "profile",
  "description": "A profile's public profile record, at the path `profile`: one per profile. A profile lives in one market, in one role; its label is <market>/<role>. The fields below are the standard's; any other field is the market's (foundationforest/markets).",
  "type": "object",
  "required": ["market", "role"],
  "properties": {
    "market": {
      "type": "string",
      "description": "The market this profile lives in, as the markets directory spells it: the first half of its label.",
      "maxLength": 64
    },
    "role": {
      "type": "string",
      "description": "Its role in that market, the second half of its label: any text. Which roles exist, and which count, is the market's and each index's.",
      "maxLength": 64
    },
    "pay": {
      "type": "object",
      "description": "Optional. The profile's payment addresses, one for each address type: keys/'s payAddresses(seed, label). Where payments to this profile go. A reader ignores a type it does not know.",
      "required": ["solana", "evm"],
      "properties": {
        "solana": {
          "type": "string",
          "description": "Its address on Solana: base58 of an ed25519 public key.",
          "minLength": 32,
          "maxLength": 44,
          "pattern": "^[1-9A-HJ-NP-Za-km-z]{32,44}$"
        },
        "evm": {
          "type": "string",
          "description": "Its address on EVM chains: 20 bytes in hex after 0x, in EIP-55's mixed-case checksum, its one spelling (keys/'s isEvmAddress checks it).",
          "pattern": "^0x[0-9a-fA-F]{40}$"
        }
      }
    },
    "inboxKey": {
      "type": "string",
      "description": "Optional. The profile's inbox key, as an age post-quantum hybrid key (`age1pq1…`, mlkem768x25519, 1,959 characters): what senders seal messages to, and others seal private records to. Without it, nobody can seal anything to this profile.",
      "pattern": "^age1pq1[02-9ac-hj-np-z]{1952}$"
    },
    "inbox": {
      "$ref": "#/$defs/inbox"
    },
    "proofs": {
      "type": "array",
      "description": "Optional. Proofs the profile shows, each one data anyone checks with its circuit's proof check (proofs/), for this profile's key.",
      "items": {
        "$ref": "#/$defs/proof"
      },
      "maxItems": 4
    }
  },
  "$defs": {
    "inbox": {
      "type": "object",
      "description": "Optional. The profile's inbox: who may deliver a message to it on its hosts. Senders seal each message to inboxKey, so a profile with an inbox also gives inboxKey. Without this field there is no inbox, and hosts refuse deliveries. A host refuses deliveries to an inbox it cannot read: a field, a rule or a value it does not know.",
      "required": ["senders"],
      "additionalProperties": false,
      "properties": {
        "senders": {
          "description": "Who may deliver: anyone, or a profile whose profile record carries a stamp proof from this verifier, under any label.",
          "oneOf": [
            {
              "const": "anyone"
            },
            {
              "type": "object",
              "required": ["verifier"],
              "additionalProperties": false,
              "properties": {
                "verifier": {
                  "type": "string",
                  "description": "The verifier's key: its address, a packed point on Baby Jubjub in base58.",
                  "minLength": 32,
                  "maxLength": 44,
                  "pattern": "^[1-9A-HJ-NP-Za-km-z]{32,44}$"
                }
              }
            }
          ]
        },
        "once": {
          "const": true,
          "description": "Optional. One message from each sender, ever: a host refuses a second from the same key for as long as it keeps the profile."
        },
        "maxBytes": {
          "type": "integer",
          "description": "Optional. The largest message it takes, as canonical text in bytes. A host also takes messages only up to its own size.",
          "minimum": 0
        }
      }
    },
    "proof": {
      "type": "object",
      "description": "One proof, named by its circuit. A reader ignores a proof whose circuit it does not know, so a profile carrying a newer kind stays valid for an older app. A stamp proof and a reputation proof have the shapes below; another circuit's fields are its own.",
      "required": ["circuit"],
      "properties": {
        "circuit": {
          "type": "string",
          "description": "The circuit that checks it: stamp (proofs/stamp/) and reputation (proofs/reputation/) have the shapes below.",
          "pattern": "^[a-z][a-z0-9-]{0,31}$"
        }
      },
      "allOf": [
        {
          "if": {
            "properties": {
              "circuit": {
                "const": "reputation"
              }
            }
          },
          "then": {
            "$ref": "#/$defs/reputation"
          }
        },
        {
          "if": {
            "properties": {
              "circuit": {
                "const": "stamp"
              }
            }
          },
          "then": {
            "$ref": "#/$defs/stamp"
          }
        }
      ]
    },
    "stamp": {
      "type": "object",
      "description": "A stamp proof (proofs/stamp/): the verifier with this key and this name signed a stamp for the person whose seed gives this profile's key for this label, and this is their tag for the label at that verifier. Everything checkStamp takes but the profile's key, which is the profile's own address.",
      "required": ["circuit", "verifier", "verifierName", "label", "tag", "proof"],
      "additionalProperties": false,
      "properties": {
        "circuit": {
          "const": "stamp"
        },
        "verifier": {
          "type": "string",
          "description": "The verifier's key: its address, a packed point on Baby Jubjub in base58.",
          "minLength": 32,
          "maxLength": 44,
          "pattern": "^[1-9A-HJ-NP-Za-km-z]{32,44}$"
        },
        "verifierName": {
          "type": "string",
          "description": "The name the verifier publishes as its own, exactly as keys/'s recipe takes it: the proof's name hash is made from it.",
          "minLength": 1,
          "maxLength": 256
        },
        "label": {
          "type": "string",
          "description": "The profile's label, exactly as the seed's mix took it: the proof's scope is made from it.",
          "minLength": 1,
          "maxLength": 128
        },
        "tag": {
          "type": "string",
          "description": "The person's tag for the label at the verifier: 32 bytes big-endian, lowercase hex.",
          "pattern": "^[0-9a-f]{64}$"
        },
        "proof": {
          "type": "string",
          "description": "The proof's three points, uncompressed: 256 bytes in base64url without padding, in the reputation proof's order.",
          "pattern": "^[A-Za-z0-9_-]{342}$"
        }
      }
    },
    "reputation": {
      "type": "object",
      "description": "A reputation proof (proofs/reputation/): the count-weighted score of profiles in an index's tree that come from the same seed as this one, which profiles hidden. It holds only for this profile's key, which the proof derives from that seed. What the score means is what the index says its root holds. Everything checkReputation takes but the profile's key, which is the profile's own address.",
      "required": ["circuit", "index", "root", "time", "signature", "score", "proof"],
      "additionalProperties": false,
      "properties": {
        "circuit": {
          "const": "reputation"
        },
        "index": {
          "type": "string",
          "description": "The index's signing key: its address, a packed point on Baby Jubjub in base58.",
          "minLength": 32,
          "maxLength": 44,
          "pattern": "^[1-9A-HJ-NP-Za-km-z]{32,44}$"
        },
        "root": {
          "type": "string",
          "description": "The root of the index's tree the proof was made against: the 32 big-endian bytes the index signed, lowercase hex.",
          "pattern": "^[0-9a-f]{64}$"
        },
        "time": {
          "type": "integer",
          "description": "The time the index signed with the root, ms since 1970.",
          "minimum": 0,
          "maximum": 9007199254740991
        },
        "signature": {
          "type": "string",
          "description": "The index's signature over the root and the time, as proofs/reputation/ defines its signed bytes: EdDSA-Poseidon on Baby Jubjub, 64 bytes (R8 packed, then S) in base64url without padding.",
          "pattern": "^[A-Za-z0-9_-]{86}$"
        },
        "score": {
          "type": "integer",
          "description": "The score the proof shows: the count-weighted score of the profiles counted, rounded down.",
          "minimum": 0,
          "maximum": 4294967295
        },
        "label": {
          "type": "string",
          "description": "Present only when the proof shows one market: the label of the one profile counted, exactly as the seed's mix took it.",
          "minLength": 1,
          "maxLength": 128
        },
        "proof": {
          "type": "string",
          "description": "The proof's three points, uncompressed: 256 bytes in base64url without padding. Eight numbers of 32 bytes big-endian, in snarkjs's names pi_a[0], pi_a[1], pi_b[0][1], pi_b[0][0], pi_b[1][1], pi_b[1][0], pi_c[0], pi_c[1]: the order Ethereum's and Solana's BN254 precompiles read.",
          "pattern": "^[A-Za-z0-9_-]{342}$"
        }
      }
    }
  }
}
