{
  "market": "tutoring",
  "role": "seller",
  "pay": {
    "solana": "CW2NTeP73exnJe6vVwqfQ9iT8Q2U6fgSbPvw9cofW8jm",
    "evm": "0x1900f9C5c30615F3a5f6a0887D2DeF5bA4C7b437"
  },
  "inboxKey": "age1pq10u7gnuv3ksq2j77flvftrgzrqpvp4l4ttec7zk9fcznl0drg9q4cwfk60q3dkad6y6lm22t944vxlekxh4kdwrkdv6cs5vrjf52y06jtnu56rs94fpup3ycxy8kqlxlhr7d6cfmny559jhqkw0jjju4c878u0pdnjmqz7l9lawyy84mq0dphf83mkcg999chprmkefrjsr2lqllf6hp0ymxtky6cgdde08mn38guj45dv7ewq95z2uryhq4qxneadv6ctxc9892fjd54frh5tn404jf5ypjytp5h6h5pz890hdf5ltphasaghce9szzed077q2dg8p9j9pmx6cvxz9dh5psq3yj9s2xlaa3px4dnc2fydtyd4dqc3pnykvflvnepa0a2t6wsg00lmf04jyv85n2nmvcqvhewpwqfnym70nzk5fvpk3tvnph4j8xvu7l3ceywcerkk556djk48pj52prl4zyfte42t47mqn09fx07jcmkrzd47qwy753mex3rkzcqqvhwsrxqhxzm0gfh4r23z3zxqyed2qn35yv4c9refyshw4nvpqqe472p6usphnwkqwzvqt5f8wsqj7jq7x6t3nhuy0xq4f8vewfaww56klakmammtdsnnttgdd60k7va54jjf7tz4u8swertx42wjqz0qge2swsxrgxwg0lkz5h2n5a0d3d8xn9n3m6fj4dzcctlmkgsks56td0hda7dcx68vxtq4vslsp2s3kvc55gmvn926hxxcsgy0cnc3kcuyxsszhd24gp8hvj3e3d2ya0pvdvqj5qf3jc75x6h3nth5ge3c8l9pjpf6g943w56xgt4hn5yydnkzl58939cfdr6wjk8tynf0zjn8vclq25vffwwfe489dzjqx88c5quetyqlkzjfrqcf8t6z3qprfqygedeu2ngytrchj59zp38zptyzks4czq64lkfnxkvq03kfzurwz5xdg7dyp9f08uke9gprqxvfpradk4up64mwzlk8pxejzqc3q4jfsjl7mzfcsrpw6g7vykjjjwcvfj2kyfe0jtgzsltw9h27ga7qg3v6syvf4w2q2vzfyfmhya4d090m84cuajjz6xupg3nky5gtqfg283v48v4pq038ynf7alcfeflqajtpgtytef3sgqey36kgtrd6d222y0jyxyr26vjx6c5axu7xlthpt8hey4wdtpdvdkqm6r3ktnufjk3d3xvcpkt9daen7nj7wk84v6yplxvqjvscs9mjuq9vrj2w4j49seyerk2arqqsrz0p7ak60jgyk9mrs4mgvhmu2vzg9cf5y662sgh00zyxjtfngvvxvj405fnthhzqay2cqa76ue40vjp0tlr893qxwdamf63z5qajk9uw434pqqle97x75ee7px9wdychaqnk6gacd32yspvqsfstxg8cd7u5pu4v6pawdvehxqskhg3mvuzcugvgmpc5qxnpgy04g5mu9h3npd0vljyajzeszrl3tgmzjlx4z9wvnxe48yd56k047ume5tejj3dw65vvq9grecgfqttru4y8w9yfwrkq56akg9gdvtfyztz5g5c4pcugwxxp746hyemv55ehp6qj04853qm6rp5stasqq3sff8r2qdr7x2cuvpdt5nu6pwjw6xtvrlgxcran0zdvw96k7detexnndfscf2ktkspr5rz5rm6cxa590r8ff5xszdqtrekn2f6z9wrkzsdq3f2kcj97lr4lquh55wwjptj29h0van2z5nmftmsjx294dvl3vk3zkmtmay65638jkne0gvacap2s72z4ycjvwdrg9sggala4g8whgszna6v328xe4uvvyzp4f0u2r7grapzx7wjt3lm4kjfgcddg8cf4ge3ycwmxr3dupfq2wtg8m7wka09a84ckuvxwrns8lu4xvtnrujd384v",
  "inbox": {
    "senders": "anyone",
    "maxBytes": 16384
  },
  "proofs": [
    {
      "circuit": "reputation",
      "index": "4jNvddwkWLrr4UC9Y3sggwmoEuEVxsqcBQSTRQvW6xVP",
      "root": "243f9a664251e1ea8fea5cf10ea7d9390c0ebad2a3d86c318933bef10bcaf1f7",
      "time": 1790812800000,
      "signature": "Cbel_ds35I1uu3zbZpV77pCO9pYi3QAsxGu62efMVxTnFId_mwvZvbVMaWk5M5Xd0lBGSw8Ohs97OZpo4NGzAw",
      "score": 87,
      "proof": "DoMKlBQwdkBLHIBUb2GOZ_4RnaEi1rBaRQSog1TrXOYC16kOh3wCsv859y-kvOwmWP1Z4Ekxi9J9qmzodweakxpcQv1TbFfTnl4-jNkUyCp884OcX2-976NySimv5DoVCCBeXXbo5BcKxi56zd5-fYiHitetqwU7nEJm9PmxN6YHOd0P3P8b0e7moW1l9rVZ4NpWlZNyvaFYNSlWtfhFHxlTVVhcIjcB_-PYzRxO6RBgsJXTPpfR55c1BmdWKTLUBcTbThrw0jEAvImzlt3IpHHVykNyh_e7Dm9LfnjSONwZfLS88FIGAQca9iFzZ-JKDit8yALoNIKSvGQGIPoKpw"
    },
    {
      "circuit": "note",
      "issuer": "9PNXwbxrL3HBZVo4DyrQYSUCuHuBUnuGcmaNJzokkDRG",
      "issuerName": "issuer-a.example",
      "label": "tutoring/seller",
      "tag": "052591ea34e8e3c3529d466fb2a270142febc5d51c8f890729b9c8b110eb2a71",
      "proof": "CGTHCqMvc-zitz-6RuM1OX7DBtqBN9HG-XQagkIrF9IHGjcAetcLRH03yJeOcSr_UJRgaO_lL3Z7kmwWn172EyYca-kOTgPEmtFSLtVVrxDGZ5YM2JuY_Q-wd86zE0ojGW-SGaBrG1GeOhfNMVNbGheBAKe4dzDT9VY2FwX2QS4K0QJKqja9ePLvKrGVAKQauRQT88z4095g62ErdOkrhyfQfaQkcOLwfV_QLPv_MB0zYEHptlUOKyzlfBvnuyjjDVKOjpLm7EuqVEUdknSzqpDsN7cUBi_GGp-IbG8c6SkCkLibgHTUC6WBHokknYO1GIDPR3eoXQCCmw5QN93YRA"
    }
  ]
}
